{"acceptance_gates": ["The family slice must include bracketing, VC-subgraph, and Donsker benchmark tasks.", "Seed-registry evidence must be verified by the local Lake verifier for every task in the slice.", "External model rows remain blocked until adapter-produced attempts and verifier reports are checked in.", "Blocked external rows must preserve concrete missing-runtime or missing-result-file reasons."], "adapter_contract": "Each external prover adapter must emit ProofAttempt JSONL and VerificationReport JSONL over exactly this empirical-process task slice before it is compared with seed-registry evidence.", "baseline_count": 5, "benchmark_path": "benchmarks/seeds.jsonl", "best_available_baseline": "seed-registry", "blocked_count": 4, "families": [{"gate_status": "ready_for_lemma_targets", "interface_family": "bracketing", "missing_task_ids": [], "seed_registry_pass_rate": 1.0, "seed_registry_passed": 25, "seed_registry_status": "verified", "target_id": "bracketing_gc_interface", "task_count": 25, "task_ids": ["bracketing_certificate_gc_seed", "bracketing_deterministic_bound_seed", "concrete_empirical_measure_bridge_constructor_seed", "empirical_measure_of_sample_bridge_constructor_seed", "empirical_measure_of_sample_endpoint_agreement_seed", "finite_bracket_empirical_measure_assembly_seed", "finite_bracket_empirical_measure_constructor_seed", "finite_bracket_empirical_measure_gc_seed", "finite_bracket_endpoint_control_constructor_seed", "finite_bracket_endpoint_control_gc_seed", "finite_bracket_process_endpoints_eventual_bound_seed", "finite_bracket_sample_average_assembly_seed", "finite_bracket_sample_average_constructor_seed", "finite_bracket_sample_average_gc_seed", "finite_bracket_sample_empirical_measure_assembly_seed", "finite_bracket_sample_empirical_measure_constructor_seed", "finite_bracket_sample_empirical_measure_gc_seed", "finite_endpoint_process_strong_law_eventual_bound_seed", "finite_endpoint_strong_law_eventual_bound_seed", "finite_l1_bracketing_every_scale_projection_seed", "finite_l1_bracketing_number_at_scale_seed", "finite_l1_bracketing_number_constructor_seed", "l1_bracketing_sequence_gc_seed", "trivial_bracketing_gc_non_vacuity_seed", "vdvw_2_4_1_current_gc_bridge_seed"]}, {"gate_status": "ready_for_lemma_targets", "interface_family": "vc_subgraph", "missing_task_ids": [], "seed_registry_pass_rate": 1.0, "seed_registry_passed": 3, "seed_registry_status": "verified", "target_id": "vc_subgraph_gc_interface", "task_count": 3, "task_ids": ["trivial_vc_subgraph_gc_non_vacuity_seed", "vc_deviation_certificate_gc_seed", "vc_subgraph_route_certificate_seed"]}, {"gate_status": "ready_for_lemma_targets", "interface_family": "donsker", "missing_task_ids": [], "seed_registry_pass_rate": 1.0, "seed_registry_passed": 5, "seed_registry_status": "verified", "target_id": "donsker_bridge_interface", "task_count": 5, "task_ids": ["donsker_asymptotic_normality_handoff_seed", "donsker_bridge_estimator_clt_seed", "donsker_bridge_gc_projection_seed", "donsker_statement_seed", "trivial_donsker_asymptotic_normality_seed"]}], "family_count": 3, "ingested_count": 1, "interface_families": ["bracketing", "vc_subgraph", "donsker"], "notes": "P10.M5 materializes the empirical-process external prover slice separately from the generic held-out split, so bracketing, VC-subgraph, and Donsker benchmark families can be evaluated together once external prover adapters are available.", "report_id": "empirical-process-external-prover-slice::p10", "rows": [{"attempts_path": "artifacts/external_baselines/empirical_process/seed-registry-empirical-process-attempts.jsonl", "baseline_id": "seed-registry", "blocked_reasons": [], "display_name": "Checked-in seed registry proof render", "evaluated_task_count": 33, "failed": 0, "failure_categories": {}, "ingestion_status": "ingested", "mean_premise_recall": 1.0, "mean_reward": 10.11818181818182, "pass_rate": 1.0, "passed": 33, "planned_status": "ready", "reports_path": "artifacts/external_baselines/empirical_process/seed-registry-empirical-process-reports.jsonl", "runner_type": "local_oracle", "source": "checked_in_seed_registry_fallback", "status_counts": {"accepted": 33, "error": 0, "rejected": 0, "timeout": 0}, "summary_path": "artifacts/external_baselines/empirical_process/seed-registry-empirical-process-summary.json", "target_task_count": 33}, {"attempts_path": "artifacts/external_baselines/empirical_process/reprover-byt5-empirical-process-attempts.jsonl", "baseline_id": "reprover-byt5", "blocked_reasons": ["LeanDojo/ReProver runtime", "model checkpoint", "premise index adapter", "missing result file: artifacts/external_baselines/empirical_process/reprover-byt5-empirical-process-attempts.jsonl", "missing result file: artifacts/external_baselines/empirical_process/reprover-byt5-empirical-process-reports.jsonl"], "display_name": "LeanDojo/ReProver retrieval-augmented tactic model", "evaluated_task_count": 0, "failed": 0, "failure_categories": {}, "ingestion_status": "blocked_by_plan_status", "mean_premise_recall": 0.0, "mean_reward": 0.0, "pass_rate": 0.0, "passed": 0, "planned_status": "requires_model_setup", "reports_path": "artifacts/external_baselines/empirical_process/reprover-byt5-empirical-process-reports.jsonl", "runner_type": "external_model", "source": "missing", "status_counts": {"accepted": 0, "error": 0, "rejected": 0, "timeout": 0}, "summary_path": "artifacts/external_baselines/empirical_process/reprover-byt5-empirical-process-summary.json", "target_task_count": 33}, {"attempts_path": "artifacts/external_baselines/empirical_process/deepseek-prover-v2-7b-empirical-process-attempts.jsonl", "baseline_id": "deepseek-prover-v2-7b", "blocked_reasons": ["model weights or endpoint", "GPU or hosted inference", "whole-proof adapter", "missing result file: artifacts/external_baselines/empirical_process/deepseek-prover-v2-7b-empirical-process-attempts.jsonl", "missing result file: artifacts/external_baselines/empirical_process/deepseek-prover-v2-7b-empirical-process-reports.jsonl"], "display_name": "DeepSeek-Prover-V2 7B whole-proof generator", "evaluated_task_count": 0, "failed": 0, "failure_categories": {}, "ingestion_status": "blocked_by_plan_status", "mean_premise_recall": 0.0, "mean_reward": 0.0, "pass_rate": 0.0, "passed": 0, "planned_status": "requires_model_setup", "reports_path": "artifacts/external_baselines/empirical_process/deepseek-prover-v2-7b-empirical-process-reports.jsonl", "runner_type": "external_model", "source": "missing", "status_counts": {"accepted": 0, "error": 0, "rejected": 0, "timeout": 0}, "summary_path": "artifacts/external_baselines/empirical_process/deepseek-prover-v2-7b-empirical-process-summary.json", "target_task_count": 33}, {"attempts_path": "artifacts/external_baselines/empirical_process/kimina-prover-rl-1.7b-empirical-process-attempts.jsonl", "baseline_id": "kimina-prover-rl-1.7b", "blocked_reasons": ["model weights or endpoint", "Kimina Lean Server optional", "whole-proof adapter", "missing result file: artifacts/external_baselines/empirical_process/kimina-prover-rl-1.7b-empirical-process-attempts.jsonl", "missing result file: artifacts/external_baselines/empirical_process/kimina-prover-rl-1.7b-empirical-process-reports.jsonl"], "display_name": "Kimina-Prover RL 1.7B whole-proof generator", "evaluated_task_count": 0, "failed": 0, "failure_categories": {}, "ingestion_status": "blocked_by_plan_status", "mean_premise_recall": 0.0, "mean_reward": 0.0, "pass_rate": 0.0, "passed": 0, "planned_status": "requires_model_setup", "reports_path": "artifacts/external_baselines/empirical_process/kimina-prover-rl-1.7b-empirical-process-reports.jsonl", "runner_type": "external_model", "source": "missing", "status_counts": {"accepted": 0, "error": 0, "rejected": 0, "timeout": 0}, "summary_path": "artifacts/external_baselines/empirical_process/kimina-prover-rl-1.7b-empirical-process-summary.json", "target_task_count": 33}, {"attempts_path": "artifacts/external_baselines/empirical_process/general-llm-codex-empirical-process-attempts.jsonl", "baseline_id": "general-llm-codex", "blocked_reasons": ["agent harness", "timeout policy", "attempt capture adapter", "missing result file: artifacts/external_baselines/empirical_process/general-llm-codex-empirical-process-attempts.jsonl", "missing result file: artifacts/external_baselines/empirical_process/general-llm-codex-empirical-process-reports.jsonl"], "display_name": "General coding-agent Lean proof baseline", "evaluated_task_count": 0, "failed": 0, "failure_categories": {}, "ingestion_status": "blocked_by_plan_status", "mean_premise_recall": 0.0, "mean_reward": 0.0, "pass_rate": 0.0, "passed": 0, "planned_status": "requires_harness", "reports_path": "artifacts/external_baselines/empirical_process/general-llm-codex-empirical-process-reports.jsonl", "runner_type": "agentic_llm", "source": "missing", "status_counts": {"accepted": 0, "error": 0, "rejected": 0, "timeout": 0}, "summary_path": "artifacts/external_baselines/empirical_process/general-llm-codex-empirical-process-summary.json", "target_task_count": 33}], "target_report_id": "empirical-process-targets::p9", "target_task_count": 33, "target_task_ids": ["bracketing_certificate_gc_seed", "bracketing_deterministic_bound_seed", "l1_bracketing_sequence_gc_seed", "finite_l1_bracketing_number_at_scale_seed", "finite_l1_bracketing_every_scale_projection_seed", "finite_l1_bracketing_number_constructor_seed", "finite_endpoint_strong_law_eventual_bound_seed", "finite_endpoint_process_strong_law_eventual_bound_seed", "finite_bracket_process_endpoints_eventual_bound_seed", "finite_bracket_endpoint_control_constructor_seed", "finite_bracket_endpoint_control_gc_seed", "finite_bracket_sample_average_assembly_seed", "finite_bracket_sample_average_constructor_seed", "finite_bracket_sample_average_gc_seed", "finite_bracket_empirical_measure_assembly_seed", "finite_bracket_empirical_measure_constructor_seed", "finite_bracket_empirical_measure_gc_seed", "finite_bracket_sample_em